name,short_description,description,type,available_formats,source,coverage_extent,data_download_lvl,footprint,download_size,recommended_use,date_created,tags,known_issues,alternative_data,derivative_data,relationship_tag,category,download,download_link,order,wms_category,wms_link,pop_link,status_map_cartodb_id,agency,agency_web,agency_gis_page
"TNRIS 2011 50cm Blanco, Caldwell, Gonzales, Kendall, Kerr","Lidar Data for  Blanco, Caldwell, Gonzales, Kendall, & Kerr","The project area is 802 DOQQQ tiles covering approximately 3241 square miles in the central region of Texas.  The project design of the Lidar data acquisition was developed to support a nominal post spacing of 4 points per square meter.  The dates of acquisiton were from February 4, 2011 to March 5, 2011.  A Leica ALS50 phase II+ and a Leica ALS60 Lidar sensor (Gonzales Block) were used collecting multiple return x, y, and z data as well as intensity data. Lidar data was processed to achieve a bare ground surface.  Lidar data is remotely sensed high-resolution elevation data collected by an airborne collection platform. Using a combination of laser range finding, GPS positioning and inertial measurement technologies, Lidar instruments are able to make highly detailed Digital Elevation Models (DEMs) of the earths terrain, man-made structures and vegetation.

The purpose of this project is to collect and deliver topographic elevation point data derived from multiple return light detection and ranging (Lidar) measurements for north region in Texas. The elevation data will be used as base data for Texas flood plain mapping.",Raster,LAS,TNRIS,"Blanco, Caldwell, Gonzales, Kendall, Kerr",,DOQQQ,,"Basemap, Research, Analysis",2011,"Blanco, Caldwell, Gonzales, Kendall, Kerr, Lidar, Point Cloud,  LAS, Elevation, County, Historical",,"DEM, Breaklines",None,,Elevation - Lidar,,,T,,,,35c6a6b8-e2bd-11e4-8983-0e4fddd5de28,,,
"TNRIS 2011 50cm Collin, Denton, Kaufman","Lidar data for Collin, Denton and Kaufman County","The project area is 608 DOQQQ tiles covering approximately 2373 square miles in the north region of Texas.  The project design of the Lidar data acquisition was developed to support a nominal post spacing of 4 points per square meter.  The dates of acquisiton were from January 21, 2011 to April 1, 2011.  A Leica ALS 50 phase II + Lidar sensor was used collecting multiple return x, y, and z data as well as intensity data. Lidar data was processed to achieve a bare ground surface.  Lidar data is remotely sensed high-resolution elevation data collected by an airborne collection platform. Using a combination of laser range finding, GPS positioning and inertial measurement technologies, Lidar instruments are able to make highly detailed Digital Elevation Models (DEMs) of the earths terrain, man-made structures and vegetation.",Raster,LAS,TNRIS,"Collin, Denton, Kaufman,cooke, Grayson, Fannin, Hunt",,DOQQ,,"Basemap, Research, Analysis",2010,"Collin, Denton, Kaufman, Cooke,Grayson,Hunt, Fannin Lidar, Point Cloud,  LAS, Elevation, County, Historical",,"DEM, Breaklines",None,,Elevation - Lidar,,,T,,,,e59932b6-4ceb-11e5-b6a1-0e9d821ea90d,,,
TNRIS 2012 50cm DeWitt,Lidar data for DeWitt.,"detailed Digital Elevation Models (DEMs) of the earths terrain, man-made structures and vegetation.</abstract><purpose>The purpose of this project is to collect and deliver topographic elevation point data derived from multiple return light detection and ranging (Lidar) measurements for portions of Shelby, Sabine, and Newton counties in Texas. The elevation data will be used as base data for Texas flood plain mapping.",Raster,LAS,TNRIS,Small Portions of DeWitt,,DOQQQQ,,"Basemap, Research, Analysis",2012,"DeWitt, Lidar, Point Cloud,  LAS, Elevation, County, Historical",,"DEM, Breaklines",None,,Elevation - Lidar,,,T,,,,c065b750-e2bd-11e4-8811-0e853d047bba,,,
TNRIS 2012 50cm TCEQ Dam Safety Sites,Lidar data for TCEQ Dam Safety Sites.,"This metadata record describes the topographic mapping of eleven small project sites mapped throughout Central and Eastern Texas in April of 2012. Site A consisted of a total of 40 individual tiles. The product covered by this metadata file consists of classified Lidar point clouds in .LAS format, collected with a Trimble Harrier 68i Lidar sensor by SAM, Inc. 

The purpose of this Lidar data is to become part of an ongoing data collection by the State of Texas to support mapping and modeling of flood plains, hydrography, and terrain. The data will also be used by the Texas Commission on Environmental Quality (TCEQ) Dam Safety staff in the performance of hydraulic modeling to determine potential areas of inundation downstream of dam structures for inclusion in Emergency Action Plans and to more accurately assess the downstream hazard rating.",Raster,LAS,TNRIS,"Small Portions of Marion, Harrison, Smith, Henderson, Anderson, Ellis, Hood, Johnson, Callahan, Bandera",,DOQQQQ,,"Basemap, Research, Analysis",2012,"Marion, Harrison, Smith, Henderson, Anderson, Ellis, Hood, Johnson, Callahan, Bandera, Lidar, Point Cloud,  LAS, Elevation, County, Historical",,"DEM, Breaklines",None,,Elevation - Lidar,,,T,,,,6c812f96-e2c4-11e4-b38f-0e0c41326911,,,
"TNRIS 2013 50cm Ellis, Navarro,Wilson & Karnes","Lidar data for Ellis, Navarros.","High Resolution Elevation Data for TWDB Project 580120703. This metadata file describes the attributes of the LAS deliverable for the Texas Water Development Board project number 580120703, specifically for the Central Area of Interest (AOI). The purpose of this project is to support the ongoing data collection efforts by the State of Texas to facilitate the mapping and modeling of flood plains, hydrography, and terrain. Aerial Lidar data was collected for this project, encompassing two distinct Areas of Interest (AOIs) within the State of Texas. 

These AOIs were designated as the Northern and Central AOIs. The Northern AOI covered portions of the following counties in TX: Parker, Hood, Johnson, Ellis, Hill, Navarro, Henderson, McLennan, Limestone, Kaufmann, and Falls. The Central AOI covered portions of the following counties in TX: Guadalupe, Atascosa, Wilson, Gonzales, Karnes, DeWitt, Live Oak, and Bee.  The Lidar collected was calibrated and processed to produce digital elevation model (DEM), Lidar intensity image, classified LAS point cloud, and hydro-breakline files for the geographic areas covered by the AOIs. The total area encompassed by this project was 4,542 square miles and was supplemented by the collection of a 300m buffer to ensure coverage. 

The data are intended to exceed requirements for Federal Emergency Management Agency (FEMA) specifications for Floodplain Mapping as well as serve as an input to the U.S. Geological Survey refinements to the National Elevation Dataset. The products acquired by this contract will be made available in the public domain through the Texas Natural Resources Information System (TNRIS) for use by government and the public. 

The purpose of this project was to collect and deliver high resolution topographic elevation point data derived from multiple return light detection and ranging (Lidar) measurements for two areas of interest in TX. The elevation data will be used as base data for various types of modeling and analysis",Raster,LAS,TNRIS,"Hill, Navarro, Ellis, Johnson, McLennan, Henderson,Wilson, Karnes",,DOQQQQ,,"Basemap, Research, Analysis",2013,"Hill, Navarro, Ellis, Johnson, McLennan,Wilson , Karnes, Henderson, Lidar, Point Cloud,  LAS, Elevation, County, Historical",,"DEM, Breaklines",None,,Elevation - Lidar,,,T,,,,d303a758-e2bf-11e4-ae2c-0e9d821ea90d,,,
TNRIS 2014 50cm Bandera & Lampasas,Lidar data for Bandera & Lampasas.,"This data has been acquired and developed by the Texas Natural Resources Information System (TNRIS) for collection and delivery of topographic elevation point data derived from multiple return light detection and ranging (Lidar) measurements for the 2256 sq. mile project area encompassing Bandera and Lampasas Counties, Texas. Fugro EarthData, Inc. acquired 305 flight lines in 36 lifts from December 18, 2013 to January 25, 2014. Lidar data collection was performed with a Cessna 310 twin engine aircraft, utilizing a Riegl LMS-Q680i Lidar sensor; collecting multiple return x, y, and z as well as intensity data. The classified Lidar point cloud data are delivered in LAS 1.2 format: 1, unclassified, 2, bare-earth ground, 3, low vegetation, 4, medium vegetation, 5, high vegetation, 6, buildings, 7, low points(noise), 9, water, 13, bridges, and 14, culverts. Specialized in-house and commercial software processes the native Lidar data into 3-dimensional positions that can be imported into GIS software for visualization and further analysis. The horizontal datum for the data is in UTM 14N Coordinates, NAD83(2011) in meters and the vertical datum is the North American Vertical Datum of 1988 (NAVD88) in meters using GEIOD12A.

The data acquired will become part of an ongoing data collection by the State of Texas to support mapping and modeling of flood plains, hydrography, and terrain.The data are intended to exceed requirements for Federal Emergency Management Agency (FEMA) specifications for Floodplain Mapping as well as serve as an input to the U.S. Geological Survey refinements to the National Elevation Dataset. The project consists of high accuracy classified Lidar data in LAS format as well as raster digital elevation models and intensity images.",Raster,LAS,TNRIS,"Bandera, Kendell, Lampasas",,DOQQQQ,,"Basemap, Research, Analysis",2014,"Bandera, Kendell, Lampasas, Lidar, Point Cloud,  LAS, Elevation, County, Historical",,"DEM, Breaklines, Contours (Fort Bend Only)",None,,Elevation - Lidar,,,T,,,,27c4e8f0-e2c1-11e4-8fe0-0e853d047bba,,,
TNRIS 2014 50cm Fort Bend,Lidar data for Fort Bend.,"This data has been acquired and developed by the Texas Natural Resources Information System (TNRIS) for collection and delivery of topographic elevation point data derived from multiple return light detection and ranging (Lidar) measurements for the 918 sq. mile project area encompassing Fort Bend County, Texas. Fugro EarthData, Inc. acquired 104 flight lines in 9 lifts from February 12, 2014 to February 27, 2014. Lidar data collection was performed with a Cessna 310 twin engine aircraft, utilizing a Riegl LMS-Q680i Lidar sensor; collecting multiple return x, y, and z as well as intensity data. The classified Lidar point cloud data are delivered in LAS 1.2 format: 1, unclassified, 2, bare-earth ground, 3, low vegetation, 4, medium vegetation, 5, high vegetation, 6, buildings, 7, low points(noise), 9, water, 13, bridges, and 14, culverts. Specialized in-house and commercial software processes the native Lidar data into 3-dimensional positions that can be imported into GIS software for visualization and further analysis. The horizontal datum for the data is in NAD1983 State Plane TX South Central FIPS 4204 in Feet and the vertical datum is the North American Vertical Datum of 1988 (NAVD88) in feet using GEIOD12A.

The data acquired will become part of an ongoing data collection by the State of Texas to support mapping and modeling of flood plains, hydrography, and terrain.The data are intended to exceed requirements for Federal Emergency Management Agency (FEMA) specifications for Floodplain Mapping as well as serve as an input to the U.S. Geological Survey refinements to the National Elevation Dataset. The project consists of high accuracy classified Lidar data in LAS format as well as raster digital elevation models and intensity images.",Raster,LAS,TNRIS,Fort Bend,,DOQQQQ,,"Basemap, Research, Analysis",2014,"Fort Bend, Lidar, Point Cloud,  LAS, Elevation, County, Historical",,"DEM, Breaklines",None,,Elevation - Lidar,,,T,,,,833da5f0-e2c1-11e4-b1d4-0e853d047bba,,,
"TNRIS 2014 50cm Henderson, Smith, Van Zandt, Trinity River","Lidar data for Henderson, Smith, Van Zandt, Trinity River.","This metadata file describes the attributes of the LAS deliverable for the Texas Water Development Board project number 580141004, specifically for AOI 4 . The purpose of this project is to support the ongoing data collection efforts by the State of Texas to facilitate the mapping and modeling of flood plains, hydrography, and terrain. Lidar data was collected for this project, encompassing four distinct Areas of Interest (AOIs) within the State of Texas. These AOIs have been designated as AOI 1 through AOI 4. AOI1 covers portions of the following counties in TX: Rains, Wood, Upshur, Van Zandt, Smith, Gregg, Henderson and Cherokee. The AOI 2 is within Dallas County. AOI 3 covers portions of Ellis and Kaufman Counties. The remaining AOI 4 covers portions of the following counties in TX: Navarro, Henderson, Freestone and Anderson. The Lidar was calibrated and processed to produce digital elevation model (DEM), Lidar intensity image, classified LAS point cloud, and hydro-breakline files for the areas covered by the AOIs. The data is intended to exceed requirements for Federal Emergency Management Agency (FEMA) specifications for Floodplain Mapping as well as serve as an input to the U.S. Geological Survey refinements to the National Elevation Dataset. The products acquired by this contract are to be made available in the public domain through the Texas Natural Resources Information System (TNRIS) for use by government and the public. The project team includes Atkins North America, Inc., Williams Aerial and Mapping (WAM), and McKim &amp; Creed. Fugro Geospatial Inc. conducted an independent QA/QC of the project deliverables for TNRIS. Project stakeholders include the Texas Natural Resources Information System (TNRIS), the Texas Commission on Environmental Quality (TCEQ), the City of Tyler (COT), the Trinity River Authority (TRA), and the Tarrant Regional Water District (TRWD).

The purpose of this project was to collect and deliver high resolution topographic elevation point data derived from multiple return light detection and ranging (Lidar) measurements encompassing four areas of interest in TX. The elevation data will be used as base data for various types of modeling and analysis",Raster,LAS,TNRIS,"Henderson, Smith, Van Zandt, Trinity River",,DOQQQQ,,"Basemap, Research, Analysis",2014,"Henderson, Smith, Van Zandt, Trinity River, Lidar, Point Cloud,  LAS, Elevation, County, Historical",,"DEM, Breaklines",None,,Elevation - Lidar,,,T,,,,e2bef3da-e2c1-11e4-a3e6-0e853d047bba,,,
TNRIS 2015 50cm Brazos County,"Lidar data for Brazos, Texas","The City of Bryan, the City of College Station and Texas A&M Partnered to acquire High quality LiDAR data through the High Priority Imagery and Data Sets program. The project area is approximately 286 square miles in Brazos County, Texas. The data was acquired by Dewberry with third party QAQC from Surveying and Mapping, LLC.  The project design of the LiDAR data acquisition was developed to support a  point density of 4 points per square meter, The dates of acquisition are February 9-10, 2015. The purpose of this LiDAR data was to produce high accuracy 3D elevation products, including tiled LiDAR in LAS 1.4 format, 3D breaklines, and 1 meter cell size hydro flattened Digital Elevation Models (DEMs).
                                                                                                                                                                                                
- **Projection**: UTM Zone 14 North.  
- **Horizontal datum**: North American Datum of 1983 (NAD83(2011)).  
- **Vertical datum**: North American Vertical Datum of 1988 (NAVD88) using the latest geoid (Geoid12a) for converting ellipsoidal heights to orthometric heights.  
- **Units**: meters (to 1cm) 
- **Point density**: 4 points per square meter. 
                                                                                                                        ",Raster,LAS,Brazos County,Brazos County,,DOQQQQ,,"Basemap, Research, Analysis",2015,"Brazos county, City of College Station, City of Bryan, Lidar, Point Cloud,  LAS, Elevation, County, Historical",,"DEM, Breaklines",None,,Elevation - Lidar,,,T,,,,9214a5fa-63b4-11e5-9475-0e73ffd62169,,,
TNRIS 5ft Contours,5ft Contours derived from available Lidar,"Using Global Mapper 16, TNRIS generated contours from digital elevation models for each corresponding Lidar dataset. Sample spacing used to create contours is consist with the nominal point spacing of the source Lidar dataset from which it was derived. The contour lines were smoothed using Global Mapper's automated process algorithms. ",Vector,Shapefile,"TNRIS, CAPCOG, FEMA, LCRA",Texas,DOQ,Statewide,150 MB,Basemap,2015,"Texas, Lidar, Elevation, Contours",,Lidar LAS and DEM,None,,Elevation - Contours,T,,T,,,,e75c7f6c-6c2c-11e5-bfbf-0ecfd53eb7d3,,,
TPWD 2014 50cm Palo Pinto Mountains State Park,Lidar data for Palo Pinto Mountains State Park,"This data has been acquired and developed by the Texas Parks and Wildlife Department for collection and delivery of topographic elevation point data derived from multiple return light detection and ranging (Lidar) measurements for the 50 sq. mile project area encompassing the planned Palo Pinto Mountains State Park. Fugro EarthData, Inc. acquired 21 flight lines in 2 lifts on December 17, 2013. Lidar data collection was performed with a Cessna 310 twin engine aircraft, utilizing a Riegl LMS-Q680i Lidar sensor; collecting multiple return x, y, and z as well as intensity data. The classified Lidar point cloud data are delivered in LAS 1.2 format: 1, unclassified, 2, bare-earth ground, 3, low vegetation, 4, medium vegetation, 5, high vegetation, 6, buildings, 7, low points(noise), 9, water, 13, bridges, and 14, culverts. Specialized in-house and commercial software processes the native Lidar data into 3-dimensional positions that can be imported into GIS software for visualization and further analysis. The horizontal datum for the data is UTM Coordinates, NAD83(2011) in meters and the vertical datum is the North American Vertical Datum of 1988 (NAVD88) in meters using GEIOD12A. 

The data acquired will become part of an ongoing data collection by the State of Texas to support mapping and modeling of flood plains, hydrography, and terrain.The data are intended to exceed requirements for Federal Emergency Management Agency (FEMA) specifications for Floodplain Mapping as well as serve as an input to the U.S. Geological Survey refinements to the National Elevation Dataset. The project consists of high accuracy classified Lidar data in LAS format as well as raster digital elevation models and intensity images.",Raster,LAS,TPWD,Palo Pinto Mountains State Park,,DOQQQQ,,"Basemap, Research, Analysis",2014,"Palo Pinto Mountains State Park, Lidar, Point Cloud,  LAS, Elevation, County, Historical",,"DEM, Breaklines",None,,Elevation - Lidar,,,T,,,,6c2fb97e-e2c2-11e4-8e62-0e4fddd5de28,TPWD - Texas Parks and Wildlife Department,https://tpwd.texas.gov/,https://tpwd.texas.gov/gis/data
TPWD 2015 Galveston State Park,The Galveston Island State Park Aerial Acquisition and Mapping Project.,"A LiDAR sensor system incorporating a precision digital aerial mapping camera used during clear weather during low tide conditions. Imagery acquisition for the entire project was completed in a single mobilization. Aerial photography was processed to output orthophotography at a .25’ ground resolution and was delivered in TIF/TFW and ECW/EWW format.
The project horizontal datum was relative to the North American Datum 1983 (NAD83), 2011 adjustment, projected to the Texas State Plane Coordinate System, South Central Zone (4204), The vertical datum will be relative to the North American Vertical Datum of 1988 (NAVD88) using the National Geodetic Survey (NGS) Geoid 2012A. 
Aerial imagery was controlled by ground control panels set prior to aerial acquisition SAM provided 2D planimetric and 3D topographic data of the site, approximately 1,678 acres, within open areas not obscured by trees, vegetation, or tall grass. SAM provided 1’ contour mapping of site. Aerial mapping was tested by means of “Ground Truthing” and met American Society for Photogrammetry and Remote Sensing (ASPRS) standards 1” = 50’ scale mapping with 1’ contours.",Raster\Vestot,"Jp2, LAS, DWG",TPWD,Galveston Island State PArk,,TPWD Grid,15 GB,Basemap,2015,"Galveston Island State Park, Lidar, Point Cloud,  LAS, Elevation, Imagery, County, Historical",None,None,None,,Elevation - Lidar,,,T,,,,10985ea6-5b06-11e5-95a7-0e4fddd5de28,TPWD - Texas Parks and Wildlife Department,https://tpwd.texas.gov/,https://tpwd.texas.gov/gis/data
TWDB Existing Reservoirs,Existing reservoir boundaries reflecting the 2012 State Water Plan.,"Major reservoir being defined as an impoundment that currently has at least 5,000 acre-feet of storage capacity at its normal operating level. Texas has 188 major water-supply reservoirs, and over 20 additional major reservoirs that serve no water-supply function. The major reservoirs of the state vary in size from 5,200 acre-feet conservation storage capacity for the Upper Nueces Lake to 4,472,900 acre-feet for the Toledo Bend Reservoir, which includes both the Louisiana and Texas portions of the reservoir (Appendix 6.1). Making the best use of existing reservoirs, controlling watershed erosion to maintain their holding capacity, and identifying viable sites for new reservoirs are key to effective long-term water supply management and planning in Texas.",Vector,Shapefile,TWDB,Statewide,State,,14 MB,"Planning, analysis, cartography",2012,"TWDB, Water Resources","Just polygons, minimal attributes",NHD,,,Hydrography,,http://www.twdb.texas.gov/mapping/gisdata/doc/Existing_Reservoirs.zip,,,,,d5084e86-dec9-11e4-afda-0e0c41326911,TWDB - Texas Water Development Board,http://www.twdb.texas.gov/,http://www.twdb.texas.gov/mapping/gisdata.asp
TWDB Groundwater Conservation Districts (GCD),Groundwater conservation districts in Texas. Original data is sourced from TCEQ.,"Local groundwater conservation districts (GCDs) are the state’s preferred method of groundwater management. GCDs are charged to manage groundwater by providing for the conservation, preservation, protection, recharging, and prevention of waste of the groundwater resources within their jurisdictions.",Vector,Shapefile,TCEQ/TWDB,Statewide,State,,10.5 MB,"Planning, analysis, cartography",2015,"TWDB, Water Resources",,TCEQ GCDs,,,Boundary,,http://www.twdb.texas.gov/mapping/gisdata/doc/GCD_Shapefiles.zip,,,,,d5084e86-dec9-11e4-afda-0e0c41326911,TWDB - Texas Water Development Board,http://www.twdb.texas.gov/,http://www.twdb.texas.gov/mapping/gisdata.asp
TWDB Groundwater Management Areas (GMA),"Groundwater Managment Area boundaries, as created by TWDB.","Groundwater Management Areas were created ""in order to provide for the conservation, preservation, protection, recharging, and prevention of waste of the groundwater, and of groundwater reservoirs or their subdivisions, and to control subsidence caused by withdrawal of water from those groundwater reservoirs or their subdivisions, consistent with the objectives of Section 59, Article XVI, Texas Constitution, groundwater management areas may be created..."" (Texas Water Code §35.001) Added by Acts 1995, 74th Leg., ch. 933, §2, eff. Sept. 1, 1995. The responsibility for Groundwater Management Area delineation was delegated to the Texas Water Development Board. (Section 35.004, Chapter 35, Title 2, Texas Water Code) The initial Groundwater Management Area delineations were adopted on December 15, 2002, and are modified as necessary according to agency rules. (356.21, TWDB Rules)",Vector,Shapefile,TWDB,Statewide,State,,1.81 MB,"Planning, analysis, cartography",2011,"TWDB, Water Resources",,,,,Boundary,,http://www.twdb.texas.gov/mapping/gisdata/doc/gma.zip,,,,,d5084e86-dec9-11e4-afda-0e0c41326911,TWDB - Texas Water Development Board,http://www.twdb.texas.gov/,http://www.twdb.texas.gov/mapping/gisdata.asp
TWDB Major River Basins,"The 23 major U.S.G.S. river basins of Texas, * These are not the 'official' TWDB basin boundaries.","There are eight designated coastal basins in Texas: the Neches-Trinity, Trinity-San Jacinto, San Jacinto-Brazos, Brazos-Colorado, Colorado-Lavaca, Lavaca-Guadalupe, San Antonio-Nueces, and Nueces-Rio Grande. Each coastal basin is named according to the major river basins that bound them. For example, the Nueces-Rio Grande Coastal Basin is bounded on the north by the Nueces River Basin and on the south by the Rio Grande Basin. Each coastal basin is also bounded by a bay or other outlet to the Gulf of Mexico. The unique features of each of these basins are a function of many factors, but one of the most critical is precipitation, which varies from less than 10 inches per year in the western part of the state to more than 55 inches per year in the east. Other factors include evaporation, vegetation, soil type, surface slope, geology, land use practices, and runoff.",Vector,Shapefile,USGS,Statewide,State,,3.77 MB,"Planning, analysis, cartography",2014,"TWDB, Water Resources",Not official TWDB major river basins that exist on paper.,USGS HUCs,,,Hydrography,,http://www.twdb.texas.gov/mapping/gisdata/doc/Major_River_Basins_Shapefile.zip,,,,,d5084e86-dec9-11e4-afda-0e0c41326911,TWDB - Texas Water Development Board,http://www.twdb.texas.gov/,http://www.twdb.texas.gov/mapping/gisdata.asp
TWDB PFCA Regions and Field Office,Geographic area assignments for Regional Project Teams and Inspection & Field Support Services Offices.,Geographic area assignments for Regional Project Teams and Inspection & Field Support Services Offices.,Vector,Shapefile,TWDB,Statewide,State,,3.2 MB,"Planning, analysis, cartography",2014,"TWDB, Water Resources",,,,,Boundary,,http://www.twdb.texas.gov/mapping/gisdata/doc/OPFCA.zip,,,,,d5084e86-dec9-11e4-afda-0e0c41326911,TWDB - Texas Water Development Board,http://www.twdb.texas.gov/,http://www.twdb.texas.gov/mapping/gisdata.asp
