name,short_description,description,type,available_formats,source,coverage_extent,data_download_lvl,footprint,download_size,recommended_use,date_created,tags,known_issues,alternative_data,derivative_data,relationship_tag,category,download,download_link,order,wms_category,wms_link,pop_link,status_map_cartodb_id,agency,agency_web,agency_gis_page
National Wetlands Inventory 062k,"This data set represents the extent, status, and approximate location of current and historic NWI wetland mapping projects.","This data set represents the extent, approximate location and type of wetlands and deepwater habitats in the United States and its Territories. These data delineate the areal extent of wetlands and surface waters as defined by Cowardin et al. (1979). 

Certain wetland habitats are excluded from the National mapping program because of the limitations of aerial imagery as the primary data source used to detect wetlands. These habitats include seagrasses or submerged aquatic vegetation that are found in the intertidal and subtidal zones of estuaries and near shore coastal waters. Some deepwater reef communities (coral or tuberficid worm reefs) have also been excluded from the inventory. These habitats, because of their depth, go undetected by aerial imagery. By policy, the Service also excludes certain types of ""farmed wetlands"" as may be defined by the Food Security Act or that do not coincide with the Cowardin et al. definition. 

Contact the Service's Regional Wetland Coordinator for additional information on what types of farmed wetlands are included on wetland maps.",Raster/Imagery,TIFF,U.S. Fish and Wildlife Service,Statewide coverage,DOQ,"DOQ, Statewide coverage, various polygons, scanned sheets",336 MB,"Basemap, Research",1979-2015,"National Wetlands Inventory, NWI, United States Fish and Wildlife, USFWS, Texas, Species, Habitat, Ecological, Aquatic, Deepwater, Coast",,NHD,None,,Hydrography,T,,,,,,d5084e86-dec9-11e4-afda-0e0c41326911,,,
National Wetlands Inventory 100K,"This data set represents the extent, status, and approximate location of current and historic NWI wetland mapping projects.","This data set represents the extent, approximate location and type of wetlands and deepwater habitats in the United States and its Territories. These data delineate the areal extent of wetlands and surface waters as defined by Cowardin et al. (1979). 

Certain wetland habitats are excluded from the National mapping program because of the limitations of aerial imagery as the primary data source used to detect wetlands. These habitats include seagrasses or submerged aquatic vegetation that are found in the intertidal and subtidal zones of estuaries and near shore coastal waters. Some deepwater reef communities (coral or tuberficid worm reefs) have also been excluded from the inventory. These habitats, because of their depth, go undetected by aerial imagery. By policy, the Service also excludes certain types of ""farmed wetlands"" as may be defined by the Food Security Act or that do not coincide with the Cowardin et al. definition. 

Contact the Service's Regional Wetland Coordinator for additional information on what types of farmed wetlands are included on wetland maps.",Raster/Imagery,TIFF,U.S. Fish and Wildlife Service,Statewide coverage,DOQ,"DOQ, Statewide coverage, various polygons, scanned sheets",1.47 GB,"Basemap, Research",1979-2015,"National Wetlands Inventory, NWI, United States Fish and Wildlife, USFWS, Texas, Species, Habitat, Ecological, Aquatic, Deepwater, Coast",,NHD,None,,Hydrography,T,,,,,,d5084e86-dec9-11e4-afda-0e0c41326911,,,
National Wetlands Inventory Vector,"This data set represents the extent, status, and approximate location of current and historic NWI wetland mapping projects.","This data set represents the extent, approximate location and type of wetlands and deepwater habitats in the United States and its Territories. These data delineate the areal extent of wetlands and surface waters as defined by Cowardin et al. (1979). 

Certain wetland habitats are excluded from the National mapping program because of the limitations of aerial imagery as the primary data source used to detect wetlands. These habitats include seagrasses or submerged aquatic vegetation that are found in the intertidal and subtidal zones of estuaries and near shore coastal waters. Some deepwater reef communities (coral or tuberficid worm reefs) have also been excluded from the inventory. These habitats, because of their depth, go undetected by aerial imagery. By policy, the Service also excludes certain types of ""farmed wetlands"" as may be defined by the Food Security Act or that do not coincide with the Cowardin et al. definition. 

Contact the Service's Regional Wetland Coordinator for additional information on what types of farmed wetlands are included on wetland maps.",Vector,"Shapefiles, PGDB",U.S. Fish and Wildlife Service,Statewide coverage,,"DOQ, Statewide coverage, various polygons",3.87 GB,"Basemap, Research",2010,"National Wetlands Inventory, NWI, United States Fish and Wildlife, USFWS, Texas, Species, Habitat, Ecological, Aquatic, Deepwater, Coast",,NHD,None,,Hydrography,,,T,,,,d94199ac-deed-11e4-8d3b-0e9d821ea90d,,,
Natural Regions,"This dataset was set up as a system to identify broad natural regions of Texas, to serve as a common point of reference.","This dataset was set up as a system to identify broad natural regions of Texas, to serve as a common point of reference for scientists, students, visitors and all citizens of Texas; and to locate and recommend for preservation natural areas that contain unique, significant, unusual and scenic resources, including rare or endangered species and endangered geological formations and ecosystems, with the goal of preserving elements of Texas natural diversity (LBJ School of Public Affairs, 1978 p17).",Vector,Shapefile,TPWD,Texas,,Statewide,305 KB,Basemap,,"Texas, Statewide, Texas Parks and Wildlife Department, TPWD, Natural Regions, Ecological, Species, Habitat, Ecosystem, Geology, Formation, Historical",Age,None,None,,Natural Regions,,https://tnris-datadownload.s3.amazonaws.com/d/naturalregions/state/tx/naturalregions_tx.zip,,,,,d5084e86-dec9-11e4-afda-0e0c41326911,,,
NCTCOG 2001 1ft NC,North Central Texas Council of Governments facilitated the purchase of digital aerial photography (orthos) for the following 11 counties in North Central Texas,"North Central Texas Council of Governments facilitated the purchase of digital aerial photography (orthos) for the following 11 counties in North Central Texas: Collin, Dallas, Denton, Ellis, Hunt, Johnson, Kaufman, Navarro, Rockwall, Somervell and Tarrant. The orthos are one-foot resolution and were gathered in February and March of 2001. The contractor for this project was Vargis, LLC. Each TIFF ortho tile is 3,000' x 2,000', or 0.215 square miles.",Raster,MrSID,NCTCOG,NCTCOG Counties,,NCTCOG Flight Grid,,Basemap,2001,"North Central Texas Council of Governments, NCTCOG, Dallas, Fort Worth, Tarrant, County, Regional, Orthoimagery, Aerial Imagery, Natural Color, NC, Historical",,None,None,,Aerial Orthoimagery - Regional ,,,T,,,,21dfc78e-deed-11e4-8060-0e4fddd5de28,,,
NCTCOG 2003 1ft  NC,North Central Texas Council of Governments facilitated the purchase of digital aerial photography (orthos) for the following 11 counties in North Central Texas,"North Central Texas Council of Governments facilitated the purchase of digital aerial photography (orthos) for all 16 counties in North Central Texas. The orthos are six-inch resolution for Collin, Dallas, Denton, Ellis, Kaufman, Navarro, Rockwall, and Tarrant counties and one-foot resolution for the remaining counties. Data were collected from January to March of 2003. NCTCOG's contractors for this project were Dallas Aerial Surveys and Pixxures. Each TIFF ortho tile is 3,000' x 2,000', or 0.215 square miles.",Raster,Tiff,NCTCOG,NCTCOG Counties,,NCTCOG Flight Grid,,Basemap,2003,"North Central Texas Council of Governments, NCTCOG, Dallas, Fort Worth, Tarrant, County, Regional, Orthoimagery, Aerial Imagery, Natural Color, NC, Historical",,None,None,,Aerial Orthoimagery - Regional ,,,T,,,,83c5fc04-e2b0-11e4-8e69-0e853d047bba,,,
NCTCOG 2007 1ft NC,North Central Texas Council of Governments facilitated the purchase of digital aerial photography (orthos) for the following 11 counties in North Central Texas,"The North Central Texas Council of Governments has facilitated the purchase of digital aerial photography (orthos) for the following eight counties in North Central Texas: Collin, Dallas, Denton, Ellis, Kaufman, Navarro, Rockwall and Tarrant. The orthos are six-inch resolution and were collected from January to March of 2005. NCTCOG's contractor for this project is Bohannan Huston. Each TIFF ortho tile is 3,000' x 2,000', or 0.215 square miles.",Raster,,NCTCOG,NCTCOG Counties,,NCTCOG Flight Grid,,Basemap,2007,"North Central Texas Council of Governments, NCTCOG, Dallas, Fort Worth, Tarrant, County, Regional, Orthoimagery, Aerial Imagery, Natural Color, NC, Historical",,None,None,,Aerial Orthoimagery - Regional ,,,T,,,,2bbe6dde-e2b5-11e4-b38f-0e0c41326911,,,
NOAA 2007,The Coastal Texas project area is comprised of approximately 458 square miles.,"The Coastal Texas project area is comprised of approximately 458 square miles. A total of 219 multispectral orthos were created to cover this area. Aerial imagery was collected in panchromatic, Red, Green, Blue and Near Infrared which yielded a natural color and false color infrared version of the completed digital orthophotography. Imagery was collected at an approximate altitude of 21000 feet above ground level. These data have been created as a result of the need for having geospatial data immediately available and easily accessible in order to enhance the capability of the noaa_2007 Coastal Services Center (CSC) and the USGS. The bounding coordinates provided within the Spatial Domain section represent a rectangle covering the total area in which the project is located. The actual project boundary located within this area is comprised of areas delimited by areas along the coast of the state of Texas. The Coastal Texas project area is comprised of approximately 458 square miles. A total of 219 multispectral orthos were created to cover this area. Aerial imagery was collected in panchromatic, Red, Green, Blue and Near Infrared which yielded a natural color and false color infrared version of the completed digital orthophotography. Imagery was collected at an approximate altitude of 21000 feet above ground level. An orthoimage is remotely sensed image data in which displacement of features in the image caused by terrain relief and sensor orientation have been mathematically removed. Orthoimagery combines the image characteristics of a photograph with the geometric qualities of a map.",Raster/Imagery,JP2,noaa_2007,Texas Coast (458 square miles),,DOQQ,1.03 GB,"Basemap, Research",2007,"National Oceanic and Atmospheric Administration, noaa_2007, Texas, Coast, Regional, Imagery, Aerial, Orthoimagery, Natural Color, NC, Color Infrared, CIR, Historical",,"NAIP, TOP",Mosaics,,Aerial Orthoimagery - Regional ,,,T,,,,819d89e0-deed-11e4-8ad3-0e9d821ea90d,,,
Original Texas Land Survey,An interpretation of the Original Texas Land Surveys boundaries and bay tracts.,"An interpretation of the Original Texas Land Surveys boundaries and bay tracts. The dataset was derived from the Texas General Land Office (GLO) county maps, the GLO Abstract of Original Land Titles: Volumes and Supplements, and the GLO maps of State-Owned Submerged Lands of the Texas Gulf Coast (bay tracts). 

The GLO county maps, showing the boundaries of the original land grants of the State of Texas, were compiled and drawn by GLO draftsmen. This dataset is a digital interpretation of the geographic placement of the original land grants and bay area tracts depicted on these GLO maps and is not a legal survey product.",Vector,Shapefile,TxRRC,Texas,,County,1 MB,Research,2014,"Original Texas Land Survey, OTLS, Plat, Section, Township, Public, Railroad Commission, RRC, Texas, Statewide",Dataset often confused with parcels,None,None,,Boundary,T,https://tnris-datadownload.s3.amazonaws.com/d/otls/state/tx/otls_tx.zip,,,,,d5084e86-dec9-11e4-afda-0e0c41326911,,,
PLSS Section,The Public Land Survey System (PLSS) is a way of subdividing and describing land in the United States.,"The Public Land Survey System (PLSS) is a way of subdividing and describing land in the United States. All lands in the public domain are subject to subdivision by this rectangular system of surveys, which is regulated by the U.S. Department of the Interior, Bureau of Land Management (BLM). The PLSS typically divides land into 6-mile-square townships, which is the level of information included in the National Atlas. Townships are subdivided into 36 one-mile- square sections. Sections can be further subdivided into quarter sections, quarter-quarter sections, or irregular government lots. 

Normally, a permanent monument, or marker, is placed at each section corner. Monuments are also placed at quarter-section corners and at other important points, such as the corners of government lots. Today permanent monuments are usually inscribed tablets set on iron rods or in concrete. The original PLSS surveys were often marked by wooden stakes or posts, marked trees, pits, or piles of rock, or other less-permanent markers.",Vector,Shapefile,USDA,"Counties bordering New Mexico, Oklahoma, Arkansas, Louisiana",,County,1MB,Research,2012,"Public Land Survey System, PLSS, National, Section, United States, New Mexico, Oklahoma, Arkansas, Louisiana",Limited area for Texas,None,None,,Boundary,T,,,,,,4c34b1f6-deee-11e4-a973-0e0c41326911,,,
PLSS Township,The Public Land Survey System (PLSS) is a way of subdividing and describing land in the United States.,"The Public Land Survey System (PLSS) is a way of subdividing and describing land in the United States. All lands in the public domain are subject to subdivision by this rectangular system of surveys, which is regulated by the U.S. Department of the Interior, Bureau of Land Management (BLM). The PLSS typically divides land into 6-mile-square townships, which is the level of information included in the National Atlas. Townships are subdivided into 36 one-mile- square sections. Sections can be further subdivided into quarter sections, quarter-quarter sections, or irregular government lots. 

Normally, a permanent monument, or marker, is placed at each section corner. Monuments are also placed at quarter-section corners and at other important points, such as the corners of government lots. Today permanent monuments are usually inscribed tablets set on iron rods or in concrete. The original PLSS surveys were often marked by wooden stakes or posts, marked trees, pits, or piles of rock, or other less-permanent markers.",Vector,Shapefile,USDA,"Counties bordering New Mexico, Oklahoma, Arkansas, Louisiana",,County,1MB,Research,2012,"Public Land Survey System, PLSS, National, Township, United States, New Mexico, Oklahoma, Arkansas, Louisiana",Limited area for Texas,None,None,,Boundary,T,,,,,,7bf9735c-def5-11e4-8aee-0e0c41326911,,,
Precipitation,Display and/or analyses requiring spatially distributed monthly or annual precipitation for the climatological period 1961-90.,"Display and/or analyses requiring spatially distributed monthly or annual precipitation for the climatological period 1961-90. Vector and polygon coverages of average monthly and annual precipitation for the climatological period 1961-90. 

Parameter-elevation Regressions on Independent Slopes Model (PRISM) derived raster data is the underlying data set from which the polygons and vectors were created. PRISM is an analytical model that uses point data and a digital elevation model (DEM) to generate gridded estimates of annual, monthly and event-based climatic parameters. Detailed descriptions of the PRISM raster data can be found with the accompanying raster data sets.",Vector,Shapefile,noaa_2007,Texas,,Statewide,10.05 MB,Basemap,,"National Oceanic and Atmospheric Administration, noaa_2007, Texas, Statewide, Precipitation, Rainfall, Weather",Age,None,None,,Weather,,https://tnris-datadownload.s3.amazonaws.com/d/noaa-climate/state/tx/noaa-climate_tx.zip,,,,,d5084e86-dec9-11e4-afda-0e0c41326911,,,
Shuttle Radar Topography Mission v2,The Shuttle Radar Topography Mission (SRTM) obtained elevation data on a near-global scale to generate the most complete high-resolution digital topographic database of Earth.,"The Shuttle Radar Topography Mission (SRTM) obtained elevation data on a near-global scale to generate the most complete high-resolution digital topographic database of Earth. SRTM consisted of a specially modified radar system that flew onboard the Space Shuttle Endeavour during an 11-day mission in February of 2000. 

NASA has released version 2 of the Shuttle Radar Topography Mission digital topographic data (also known as the ""finished"" version). Version 2 is the result of a substantial editing effort by the National Geospatial Intelligence Agency and exhibits well-defined water bodies and coastlines and the absence of spikes and wells (single pixel errors), although some areas of missing data ('voids') are still present",Raster,DEM,JPL,Texas +overlap,DOQ,USGS 1 Degree Block,2 MB - 18 MB,Basemap,2007,"Shuttle Radar Topography Mission, SRTM, Satellite, Elevation, Historical, Texas, Statewide","90M. Age,",None,None,,Elevation - Image,T,,,,,,d5084e86-dec9-11e4-afda-0e0c41326911,,,
Soils,This data set is a digital soil survey and generally is the most detailed level of soil geographic data developed by the National Cooperative Soil Survey.,"This data set is a digital soil survey and generally is the most detailed level of soil geographic data developed by the National Cooperative Soil Survey. The information was prepared by digitizing maps, by compiling information onto a planimetric correct base and digitizing, or by revising digitized maps using remotely sensed and other information. This data set consists of georeferenced digital map data and computerized attribute data. 

The map data are in a soil survey area extent format and include a detailed, field verified inventory of soils and miscellaneous areas that normally occur in a repeatable pattern on the landscape and that can be cartographically shown at the scale mapped. A special soil features layer (point and line features) is optional. This layer displays the location of features too small to delineate at the mapping scale, but they are large enough and contrasting enough to significantly influence use and management. The soil map units are linked to attributes in the National Soil Information System relational database, which gives the proportionate extent of the component soils and their properties. 

SSURGO depicts information about the kinds and distribution of soils on the landscape. The soil map and data used in the SSURGO product were prepared by soil scientists as part of the National Cooperative Soil Survey.",Vector,Shapefile,NRCS,Texas,County,County,,Basemap,,"Soil, SSURGO, Survey, Geographic, Database, Agriculture, USDA, United States Department of Agriculture, NRCS, Natural Resources Conservation Service",,None,None,,Natural Regions,T,https://tnris-datadownload.s3.amazonaws.com/d/nrcs-soils/state/tx/nrcs-soils_tx.zip,,,,,d5084e86-dec9-11e4-afda-0e0c41326911,,,
SPOT Select for Texas Pan BW 1999-2001 10m,SPOT Select for Texas,"The SPOT (Satellites Pour l'Observation de la Terre or Earth-observing Satellites) remote-sensing programme was set up in 1978 by France in partnership with Belgium and Sweden. The SPOT satellites constellation offers acquisition and revisit capacity allowing to acquire imagery from anywhere in the world, every day. 

Each SPOT payload comprises two identical high resolution optical imaging instruments, which can operate simultaneously or individually in either panchromatic (P mode: a single wide band in the visible part of the spectrum) or multispectral mode (XS mode: the green, red, and infrared bands of the electromagnetic spectrum). 

The orientation of each instrument's strip-selection mirror can be remotely steered by the ground stations, offering an oblique viewing capability up to angles of +/- 27 degrees from the satellite's vertical axis. In this way, the temporal resolution is shortened from 26 to 4-5 days for the temperate zones. On SPOT 5 , the HRS (High-Resolution Stereoscopic) imaging instrument also allows simultaneous acquisition of stereo pairs.",Raster,Tiff,,Texas +overlap,DOQ,"7.5"" Quad",,Basemap,,"Satellite, Observation, Earth, Imagery, Statewide, Texas, Historical",Age,None,None,,Satellite Imagery,T,,,,,,a084a9d0-def0-11e4-b24f-0e018d66dc29,,,
StratMap Boundaries,"The StratMap political boundary dataset contains political jurisdictions, state boundaries, county boundaries, city boundaries, federal parks, state parks, and landmark boundaries (airports, universities, wildlife refuges, and military bases).","The StratMap political boundary dataset contains political jurisdictions, state boundaries, county boundaries, city boundaries, federal parks, state parks, and landmark boundaries (airports, universities, wildlife refuges, and military bases). 

StratMap Boundaries are useful in right-of-way determination, highway planning and maintenance, real estate, public services, jurisdiction maintenance, and numerous administrative assignments. 

Each of the boundary datasets are derived from various sources such as the Texas Department of Transportation, Texas Parks and Wildlife, and local jurisdictions to create the most comprehensive datasets available.","Point, Polygon",Shapefile,"Federal (US Census), State (TxDOT, TPWD), Regional (COGs), Local (County, Municipalities)",Statewide coverage - Actual boundaries of polygons,,"County, City, Park, Cultural boundaries",All boundaries - 14.3 MB (zipped),"Basemap, cartographic representation, planning, etc.",Last update was April 2012,"Political jurisdictions, City, County, Park, Landmark, Boundaries, City Limits, County seats,","Not actual legal representations of boundaries, Multi-sourced, update frequency","TxDOT county and city boundaries, TWPD State Parks, GNIS",None,,Boundary,,https://tnris-datadownload.s3.amazonaws.com/d/stratmap-bnd/state/tx/stratmap-bnd_tx.zip,,,,,d5084e86-dec9-11e4-afda-0e0c41326911,,,
StratMap Hypso,Hypsography (elevation contours) derived by digitizing map features as line graph elements from the cartographic source materials.,"Hypsography (elevation contours) Digital Line Graph (DLG-3) data are currently derived by digitizing map features as line graph elements from the cartographic source materials.  The scale of the source materials is 1:24,000.",Vector,"Shapefile, GDB",TNRIS,Texas,"DOQ,Statewide","State, 7.5"" Quad",3 MB per quad,Basemap,1997,"Contour lines, Hypsography, Elevation, Topography, Interval, Historical, Isolines.","Mismatched edges, Age, Quality",None,None,,Elevation - Contours,,https://tnris-datadownload.s3.amazonaws.com/d/stratmap-hypso-ln/state/tx/stratmap-hypso-ln_tx.zip,,,,,d5084e86-dec9-11e4-afda-0e0c41326911,,,
StratMap Transportation,"This data has been retired and is no longer available for download. It can still be ordered, but only for historic purposes. ","This data has been retired and is no longer available for download. It can still be ordered, but only for historic purposes. 

The StratMap transportation layer was an updated, digital version of the transportation features found on the 7.5 minute, 1:24,000 scale USGS quadrangle maps. Where available, digital ortho-photography and GPS data are used to improve positional accuracy. 

Transportation features encompass all public roads in Texas, including city streets, state and federal highways, interstates, and selected private roads. The transportation layer is designed to be a universal transportation layer that can be integrated into a GIS application or project. The StratMap statewide transportation dataset is a publicly available digital data layer which serves as a cartographic product for seamless Basemap production.",Line,"Shapefile, FGDB",TNRIS-StratMap (TeleAtlas),"Statewide coverage, County","Statewide, County","Statewide coverage, County","Shapefiles for counties vary, Statewide FGDB is 369 MB","Basemap, cartographic representation, planning, etc.",2006,"Roads, Streets, Roadways, Centerlines","Old data/Vintage/Out of date, No address ranges","TxDOT Roadways, Census TIGER, Open Source","Road categories (Major roads, county roads, local, etc.)",,Transportation,,,T,,,,d5084e86-dec9-11e4-afda-0e0c41326911,,,
Taylor County 2002 BW,"Digital orthophoto images for the City of Abilene, Taylor County, Taylor County Central Appraisal District and Taylor County 911 Office.","Digital orthophoto images that are produced by Sanborn Map Company of San Antonio, TX for the City of Abilene, Taylor County, Taylor County Central Appraisal District and Taylor County 911 Office.  The images were developed at an original pixel resolution of 2 foot by 2 foot in Texas State Plane Coordinate System, Zone 4202, NAD83 but were resampled to 1 meter resolution and re-projected to UTM Zone 14, NAD83.",Raster,Tiff,Taylor County,Taylor County,,Taylor County Flight Grid,,Basemap,2002,"Taylor, Abilene,  Orthoimagery, Imagery, Aerial Photography, BW, Black, White","Age, Black and White, Overlap",None,None,,Aerial Orthoimagery - Regional ,,,T,,,,73050fda-def1-11e4-afc9-0e018d66dc29,,,
